{
	"$schema": "https://json-schema.org/draft/2020-12/schema",
	"type": "object",
	"properties": {
		"schemaVersion": {
			"type": "string",
			"const": "equipment-production-event-v1"
		},
		"sequence": {
			"type": "integer",
			"exclusiveMinimum": 0,
			"maximum": 9007199254740991
		},
		"previousEventCanonicalSha256": {
			"anyOf": [
				{
					"type": "string",
					"pattern": "^[a-f0-9]{64}$"
				},
				{
					"type": "null"
				}
			]
		},
		"recordedAt": {
			"type": "string",
			"format": "date-time",
			"pattern": "^(?:(?:\\d\\d[2468][048]|\\d\\d[13579][26]|\\d\\d0[48]|[02468][048]00|[13579][26]00)-02-29|\\d{4}-(?:(?:0[13578]|1[02])-(?:0[1-9]|[12]\\d|3[01])|(?:0[469]|11)-(?:0[1-9]|[12]\\d|30)|(?:02)-(?:0[1-9]|1\\d|2[0-8])))T(?:(?:[01]\\d|2[0-3]):[0-5]\\d(?::[0-5]\\d(?:\\.\\d+)?)?(?:Z|([+-](?:[01]\\d|2[0-3]):[0-5]\\d)))$"
		},
		"request": {
			"oneOf": [
				{
					"type": "object",
					"properties": {
						"schemaVersion": {
							"type": "string",
							"const": "equipment-production-event-request-v1"
						},
						"eventId": {
							"type": "string",
							"pattern": "^[a-z][a-z0-9-]{1,119}$"
						},
						"runId": {
							"type": "string",
							"pattern": "^[a-z][a-z0-9-]{1,119}$"
						},
						"requestedAt": {
							"type": "string",
							"format": "date-time",
							"pattern": "^(?:(?:\\d\\d[2468][048]|\\d\\d[13579][26]|\\d\\d0[48]|[02468][048]00|[13579][26]00)-02-29|\\d{4}-(?:(?:0[13578]|1[02])-(?:0[1-9]|[12]\\d|3[01])|(?:0[469]|11)-(?:0[1-9]|[12]\\d|30)|(?:02)-(?:0[1-9]|1\\d|2[0-8])))T(?:(?:[01]\\d|2[0-3]):[0-5]\\d(?::[0-5]\\d(?:\\.\\d+)?)?(?:Z|([+-](?:[01]\\d|2[0-3]):[0-5]\\d)))$"
						},
						"actor": {
							"type": "string",
							"minLength": 1,
							"maxLength": 120
						},
						"kind": {
							"type": "string",
							"const": "run-started"
						},
						"epochId": {
							"type": "string",
							"pattern": "^[a-z][a-z0-9-]{1,119}$"
						}
					},
					"required": [
						"schemaVersion",
						"eventId",
						"runId",
						"requestedAt",
						"actor",
						"kind",
						"epochId"
					],
					"additionalProperties": false
				},
				{
					"type": "object",
					"properties": {
						"schemaVersion": {
							"type": "string",
							"const": "equipment-production-event-request-v1"
						},
						"eventId": {
							"type": "string",
							"pattern": "^[a-z][a-z0-9-]{1,119}$"
						},
						"runId": {
							"type": "string",
							"pattern": "^[a-z][a-z0-9-]{1,119}$"
						},
						"requestedAt": {
							"type": "string",
							"format": "date-time",
							"pattern": "^(?:(?:\\d\\d[2468][048]|\\d\\d[13579][26]|\\d\\d0[48]|[02468][048]00|[13579][26]00)-02-29|\\d{4}-(?:(?:0[13578]|1[02])-(?:0[1-9]|[12]\\d|3[01])|(?:0[469]|11)-(?:0[1-9]|[12]\\d|30)|(?:02)-(?:0[1-9]|1\\d|2[0-8])))T(?:(?:[01]\\d|2[0-3]):[0-5]\\d(?::[0-5]\\d(?:\\.\\d+)?)?(?:Z|([+-](?:[01]\\d|2[0-3]):[0-5]\\d)))$"
						},
						"actor": {
							"type": "string",
							"minLength": 1,
							"maxLength": 120
						},
						"kind": {
							"type": "string",
							"const": "job-claimed"
						},
						"epochId": {
							"type": "string",
							"pattern": "^[a-z][a-z0-9-]{1,119}$"
						},
						"claimId": {
							"type": "string",
							"pattern": "^[a-z][a-z0-9-]{1,119}$"
						},
						"targetId": {
							"type": "string",
							"pattern": "^[a-z][a-z0-9-]{1,119}$"
						},
						"workerId": {
							"type": "string",
							"pattern": "^[a-z][a-z0-9-]{1,119}$"
						}
					},
					"required": [
						"schemaVersion",
						"eventId",
						"runId",
						"requestedAt",
						"actor",
						"kind",
						"epochId",
						"claimId",
						"targetId",
						"workerId"
					],
					"additionalProperties": false
				},
				{
					"type": "object",
					"properties": {
						"schemaVersion": {
							"type": "string",
							"const": "equipment-production-event-request-v1"
						},
						"eventId": {
							"type": "string",
							"pattern": "^[a-z][a-z0-9-]{1,119}$"
						},
						"runId": {
							"type": "string",
							"pattern": "^[a-z][a-z0-9-]{1,119}$"
						},
						"requestedAt": {
							"type": "string",
							"format": "date-time",
							"pattern": "^(?:(?:\\d\\d[2468][048]|\\d\\d[13579][26]|\\d\\d0[48]|[02468][048]00|[13579][26]00)-02-29|\\d{4}-(?:(?:0[13578]|1[02])-(?:0[1-9]|[12]\\d|3[01])|(?:0[469]|11)-(?:0[1-9]|[12]\\d|30)|(?:02)-(?:0[1-9]|1\\d|2[0-8])))T(?:(?:[01]\\d|2[0-3]):[0-5]\\d(?::[0-5]\\d(?:\\.\\d+)?)?(?:Z|([+-](?:[01]\\d|2[0-3]):[0-5]\\d)))$"
						},
						"actor": {
							"type": "string",
							"minLength": 1,
							"maxLength": 120
						},
						"kind": {
							"type": "string",
							"const": "claim-released"
						},
						"claimId": {
							"type": "string",
							"pattern": "^[a-z][a-z0-9-]{1,119}$"
						},
						"targetId": {
							"type": "string",
							"pattern": "^[a-z][a-z0-9-]{1,119}$"
						},
						"workerId": {
							"type": "string",
							"pattern": "^[a-z][a-z0-9-]{1,119}$"
						},
						"reason": {
							"type": "string",
							"minLength": 1,
							"maxLength": 2000
						}
					},
					"required": [
						"schemaVersion",
						"eventId",
						"runId",
						"requestedAt",
						"actor",
						"kind",
						"claimId",
						"targetId",
						"workerId",
						"reason"
					],
					"additionalProperties": false
				},
				{
					"type": "object",
					"properties": {
						"schemaVersion": {
							"type": "string",
							"const": "equipment-production-event-request-v1"
						},
						"eventId": {
							"type": "string",
							"pattern": "^[a-z][a-z0-9-]{1,119}$"
						},
						"runId": {
							"type": "string",
							"pattern": "^[a-z][a-z0-9-]{1,119}$"
						},
						"requestedAt": {
							"type": "string",
							"format": "date-time",
							"pattern": "^(?:(?:\\d\\d[2468][048]|\\d\\d[13579][26]|\\d\\d0[48]|[02468][048]00|[13579][26]00)-02-29|\\d{4}-(?:(?:0[13578]|1[02])-(?:0[1-9]|[12]\\d|3[01])|(?:0[469]|11)-(?:0[1-9]|[12]\\d|30)|(?:02)-(?:0[1-9]|1\\d|2[0-8])))T(?:(?:[01]\\d|2[0-3]):[0-5]\\d(?::[0-5]\\d(?:\\.\\d+)?)?(?:Z|([+-](?:[01]\\d|2[0-3]):[0-5]\\d)))$"
						},
						"actor": {
							"type": "string",
							"minLength": 1,
							"maxLength": 120
						},
						"kind": {
							"type": "string",
							"const": "worker-started"
						},
						"claimId": {
							"type": "string",
							"pattern": "^[a-z][a-z0-9-]{1,119}$"
						},
						"targetId": {
							"type": "string",
							"pattern": "^[a-z][a-z0-9-]{1,119}$"
						},
						"workerId": {
							"type": "string",
							"pattern": "^[a-z][a-z0-9-]{1,119}$"
						}
					},
					"required": [
						"schemaVersion",
						"eventId",
						"runId",
						"requestedAt",
						"actor",
						"kind",
						"claimId",
						"targetId",
						"workerId"
					],
					"additionalProperties": false
				},
				{
					"type": "object",
					"properties": {
						"schemaVersion": {
							"type": "string",
							"const": "equipment-production-event-request-v1"
						},
						"eventId": {
							"type": "string",
							"pattern": "^[a-z][a-z0-9-]{1,119}$"
						},
						"runId": {
							"type": "string",
							"pattern": "^[a-z][a-z0-9-]{1,119}$"
						},
						"requestedAt": {
							"type": "string",
							"format": "date-time",
							"pattern": "^(?:(?:\\d\\d[2468][048]|\\d\\d[13579][26]|\\d\\d0[48]|[02468][048]00|[13579][26]00)-02-29|\\d{4}-(?:(?:0[13578]|1[02])-(?:0[1-9]|[12]\\d|3[01])|(?:0[469]|11)-(?:0[1-9]|[12]\\d|30)|(?:02)-(?:0[1-9]|1\\d|2[0-8])))T(?:(?:[01]\\d|2[0-3]):[0-5]\\d(?::[0-5]\\d(?:\\.\\d+)?)?(?:Z|([+-](?:[01]\\d|2[0-3]):[0-5]\\d)))$"
						},
						"actor": {
							"type": "string",
							"minLength": 1,
							"maxLength": 120
						},
						"kind": {
							"type": "string",
							"const": "job-terminal"
						},
						"targetId": {
							"type": "string",
							"pattern": "^[a-z][a-z0-9-]{1,119}$"
						},
						"workerId": {
							"type": "string",
							"pattern": "^[a-z][a-z0-9-]{1,119}$"
						},
						"status": {
							"type": "string",
							"enum": [
								"candidate",
								"revise",
								"failed"
							]
						},
						"resultCanonicalSha256": {
							"anyOf": [
								{
									"type": "string",
									"pattern": "^[a-f0-9]{64}$"
								},
								{
									"type": "null"
								}
							]
						},
						"failureKind": {
							"anyOf": [
								{
									"type": "string",
									"enum": [
										"capacity",
										"provider-throttle",
										"timeout",
										"malformed-output",
										"persistence",
										"operator-confirmed",
										"other"
									]
								},
								{
									"type": "null"
								}
							]
						}
					},
					"required": [
						"schemaVersion",
						"eventId",
						"runId",
						"requestedAt",
						"actor",
						"kind",
						"targetId",
						"workerId",
						"status",
						"resultCanonicalSha256",
						"failureKind"
					],
					"additionalProperties": false
				},
				{
					"type": "object",
					"properties": {
						"schemaVersion": {
							"type": "string",
							"const": "equipment-production-event-request-v1"
						},
						"eventId": {
							"type": "string",
							"pattern": "^[a-z][a-z0-9-]{1,119}$"
						},
						"runId": {
							"type": "string",
							"pattern": "^[a-z][a-z0-9-]{1,119}$"
						},
						"requestedAt": {
							"type": "string",
							"format": "date-time",
							"pattern": "^(?:(?:\\d\\d[2468][048]|\\d\\d[13579][26]|\\d\\d0[48]|[02468][048]00|[13579][26]00)-02-29|\\d{4}-(?:(?:0[13578]|1[02])-(?:0[1-9]|[12]\\d|3[01])|(?:0[469]|11)-(?:0[1-9]|[12]\\d|30)|(?:02)-(?:0[1-9]|1\\d|2[0-8])))T(?:(?:[01]\\d|2[0-3]):[0-5]\\d(?::[0-5]\\d(?:\\.\\d+)?)?(?:Z|([+-](?:[01]\\d|2[0-3]):[0-5]\\d)))$"
						},
						"actor": {
							"type": "string",
							"minLength": 1,
							"maxLength": 120
						},
						"kind": {
							"type": "string",
							"const": "armour-source-reviewed"
						},
						"gateId": {
							"type": "string",
							"pattern": "^[a-z][a-z0-9-]{1,119}$"
						},
						"sourceTargetId": {
							"type": "string",
							"pattern": "^[a-z][a-z0-9-]{1,119}$"
						},
						"decision": {
							"type": "string",
							"enum": [
								"accepted",
								"rejected"
							]
						},
						"receiptCanonicalSha256": {
							"type": "string",
							"pattern": "^[a-f0-9]{64}$"
						}
					},
					"required": [
						"schemaVersion",
						"eventId",
						"runId",
						"requestedAt",
						"actor",
						"kind",
						"gateId",
						"sourceTargetId",
						"decision",
						"receiptCanonicalSha256"
					],
					"additionalProperties": false
				},
				{
					"type": "object",
					"properties": {
						"schemaVersion": {
							"type": "string",
							"const": "equipment-production-event-request-v1"
						},
						"eventId": {
							"type": "string",
							"pattern": "^[a-z][a-z0-9-]{1,119}$"
						},
						"runId": {
							"type": "string",
							"pattern": "^[a-z][a-z0-9-]{1,119}$"
						},
						"requestedAt": {
							"type": "string",
							"format": "date-time",
							"pattern": "^(?:(?:\\d\\d[2468][048]|\\d\\d[13579][26]|\\d\\d0[48]|[02468][048]00|[13579][26]00)-02-29|\\d{4}-(?:(?:0[13578]|1[02])-(?:0[1-9]|[12]\\d|3[01])|(?:0[469]|11)-(?:0[1-9]|[12]\\d|30)|(?:02)-(?:0[1-9]|1\\d|2[0-8])))T(?:(?:[01]\\d|2[0-3]):[0-5]\\d(?::[0-5]\\d(?:\\.\\d+)?)?(?:Z|([+-](?:[01]\\d|2[0-3]):[0-5]\\d)))$"
						},
						"actor": {
							"type": "string",
							"minLength": 1,
							"maxLength": 120
						},
						"kind": {
							"type": "string",
							"const": "epoch-paused"
						},
						"epochId": {
							"type": "string",
							"pattern": "^[a-z][a-z0-9-]{1,119}$"
						},
						"technicalFailureCount": {
							"type": "number",
							"const": 3
						},
						"reason": {
							"type": "string",
							"minLength": 1,
							"maxLength": 2000
						}
					},
					"required": [
						"schemaVersion",
						"eventId",
						"runId",
						"requestedAt",
						"actor",
						"kind",
						"epochId",
						"technicalFailureCount",
						"reason"
					],
					"additionalProperties": false
				},
				{
					"type": "object",
					"properties": {
						"schemaVersion": {
							"type": "string",
							"const": "equipment-production-event-request-v1"
						},
						"eventId": {
							"type": "string",
							"pattern": "^[a-z][a-z0-9-]{1,119}$"
						},
						"runId": {
							"type": "string",
							"pattern": "^[a-z][a-z0-9-]{1,119}$"
						},
						"requestedAt": {
							"type": "string",
							"format": "date-time",
							"pattern": "^(?:(?:\\d\\d[2468][048]|\\d\\d[13579][26]|\\d\\d0[48]|[02468][048]00|[13579][26]00)-02-29|\\d{4}-(?:(?:0[13578]|1[02])-(?:0[1-9]|[12]\\d|3[01])|(?:0[469]|11)-(?:0[1-9]|[12]\\d|30)|(?:02)-(?:0[1-9]|1\\d|2[0-8])))T(?:(?:[01]\\d|2[0-3]):[0-5]\\d(?::[0-5]\\d(?:\\.\\d+)?)?(?:Z|([+-](?:[01]\\d|2[0-3]):[0-5]\\d)))$"
						},
						"actor": {
							"type": "string",
							"minLength": 1,
							"maxLength": 120
						},
						"kind": {
							"type": "string",
							"const": "epoch-resumed"
						},
						"previousEpochId": {
							"type": "string",
							"pattern": "^[a-z][a-z0-9-]{1,119}$"
						},
						"epochId": {
							"type": "string",
							"pattern": "^[a-z][a-z0-9-]{1,119}$"
						},
						"reason": {
							"type": "string",
							"minLength": 1,
							"maxLength": 2000
						}
					},
					"required": [
						"schemaVersion",
						"eventId",
						"runId",
						"requestedAt",
						"actor",
						"kind",
						"previousEpochId",
						"epochId",
						"reason"
					],
					"additionalProperties": false
				}
			]
		}
	},
	"required": [
		"schemaVersion",
		"sequence",
		"previousEventCanonicalSha256",
		"recordedAt",
		"request"
	],
	"additionalProperties": false,
	"$id": "https://summonlab.local/schemas/equipment/run-event.schema.json"
}
