{
	"schemaVersion": "equipment-production-event-v1",
	"sequence": 63,
	"previousEventCanonicalSha256": "095039de37f0080a5f25239c8234e9125275aceaf7da04cff129e208cb001a19",
	"recordedAt": "2026-09-02T14:54:39.000Z",
	"request": {
		"schemaVersion": "equipment-production-event-request-v1",
		"eventId": "job-claimed-63",
		"runId": "material-equipment-v1-run-001",
		"requestedAt": "2026-09-02T14:54:38.000Z",
		"actor": "root-orchestrator",
		"kind": "job-claimed",
		"epochId": "equipment-epoch-001",
		"claimId": "claim-material-equipment-v1-ironwood-staff-v1-63",
		"targetId": "material-equipment-v1-ironwood-staff-v1",
		"workerId": "equipment-worker-63"
	}
}
