{
	"schemaVersion": "equipment-production-event-v1",
	"sequence": 101,
	"previousEventCanonicalSha256": "50eed8548149d81d4b2a59dc9a27d983404016726027fa5bd4200562962714df",
	"recordedAt": "2026-09-02T15:02:01.000Z",
	"request": {
		"schemaVersion": "equipment-production-event-request-v1",
		"eventId": "terminal-iron-heavy-armour-full-set-v1",
		"runId": "material-equipment-v1-run-001",
		"requestedAt": "2026-09-02T15:02:00.000Z",
		"actor": "root-orchestrator",
		"kind": "job-terminal",
		"targetId": "material-equipment-v1-iron-heavy-armour-full-set-v1",
		"workerId": "equipment-worker-50",
		"status": "revise",
		"resultCanonicalSha256": "4a090c907392e85cda12382ec5130bbd436a64effb0814a5b4419a9536560798",
		"failureKind": null
	}
}
