{
	"schemaVersion": "equipment-production-event-v1",
	"sequence": 103,
	"previousEventCanonicalSha256": "22056cbffc20ea61d1a8dfe9ce280404dc7b5c10b8dbda7bd082d566788200e0",
	"recordedAt": "2026-09-02T15:02:01.000Z",
	"request": {
		"schemaVersion": "equipment-production-event-request-v1",
		"eventId": "terminal-ironwood-bow-v1",
		"runId": "material-equipment-v1-run-001",
		"requestedAt": "2026-09-02T15:02:00.000Z",
		"actor": "root-orchestrator",
		"kind": "job-terminal",
		"targetId": "material-equipment-v1-ironwood-bow-v1",
		"workerId": "equipment-worker-62",
		"status": "revise",
		"resultCanonicalSha256": "3176461738b8e3ab2ed9817e6999ffafa9360dd4942c703b942204c0b4d531b9",
		"failureKind": null
	}
}
