{
	"schemaVersion": "equipment-production-event-v1",
	"sequence": 61,
	"previousEventCanonicalSha256": "50274c851d81b1a7452d8b2c061b988c9b5d757b8310bb3a4eb242435a7c9514",
	"recordedAt": "2026-09-02T14:54:39.000Z",
	"request": {
		"schemaVersion": "equipment-production-event-request-v1",
		"eventId": "job-claimed-61",
		"runId": "material-equipment-v1-run-001",
		"requestedAt": "2026-09-02T14:54:38.000Z",
		"actor": "root-orchestrator",
		"kind": "job-claimed",
		"epochId": "equipment-epoch-001",
		"claimId": "claim-material-equipment-v1-steel-heavy-armour-full-set-v1-61",
		"targetId": "material-equipment-v1-steel-heavy-armour-full-set-v1",
		"workerId": "equipment-worker-61"
	}
}
