{
	"schemaVersion": "equipment-production-event-v1",
	"sequence": 28,
	"previousEventCanonicalSha256": "6d82541ac4336aa1528a14a689b1c864aa3f904366793abf14adce5f15ea6f02",
	"recordedAt": "2026-09-02T14:45:03.000Z",
	"request": {
		"schemaVersion": "equipment-production-event-request-v1",
		"eventId": "worker-started-equipment-worker-12",
		"runId": "material-equipment-v1-run-001",
		"requestedAt": "2026-09-02T14:45:02.000Z",
		"actor": "root-orchestrator",
		"kind": "worker-started",
		"claimId": "claim-material-equipment-v1-hemp-weave-robes-full-set-v1-12",
		"targetId": "material-equipment-v1-hemp-weave-robes-full-set-v1",
		"workerId": "equipment-worker-12"
	}
}
