{
	"schemaVersion": "equipment-production-event-v1",
	"sequence": 32,
	"previousEventCanonicalSha256": "a2e4e4019b180d87b56b362b93b083e666da7e344dbe0102c1c26198a5a1fdaa",
	"recordedAt": "2026-09-02T14:45:03.000Z",
	"request": {
		"schemaVersion": "equipment-production-event-request-v1",
		"eventId": "worker-started-equipment-worker-16",
		"runId": "material-equipment-v1-run-001",
		"requestedAt": "2026-09-02T14:45:02.000Z",
		"actor": "root-orchestrator",
		"kind": "worker-started",
		"claimId": "claim-material-equipment-v1-iron-axe-v1-16",
		"targetId": "material-equipment-v1-iron-axe-v1",
		"workerId": "equipment-worker-16"
	}
}
